ticker,company_name,sector,sic_code,sic_description,sub_label,category,state,filing_date,item1_length,business_summary
CYTK,CYTOKINETICS INC,Healthcare,2834,Pharmaceutical Preparations,Other Therapeutics,Large accelerated filer,,2026-02-26,80000,"Liquidity and Capital Resources Our cash, cash equivalents, and investments and a summary of our borrowings and working capital as of December 31, 2025 and 2024 are summarized as follows (in millions): Cash and cash equivalents Short-term investments Long-term investments Total cash, cash equivalents, and marketable securities Term loans (including related derivative liabilities measured at fair value) Convertible notes, net Liabilities related to RPI transactions measured at fair value The foll..."
CZR,"Caesars Entertainment, Inc.",Consumer Cyclical,7011,Hotels & Motels,Resorts & Casinos,Large accelerated filer,DE,2026-02-17,27840,"In this filing, Caesars Entertainment, Inc., a Delaware corporation, and its subsidiaries may be referred to as the ""Company,"" ""CEI,"" ""Caesars,"" ""we,"" ""us"" or ""our"" or the ""Registrant."" We also refer to (i) our Consolidated Financial Statements as our ""Financial Statements,"" (ii) our Consolidated Balance Sheets as our ""Balance Sheets,"" (iii) our Consolidated Statements of Operations and Consolidated Statements of Comprehensive Income (Loss) as our ""Statements of Operations,"" and (iv) our Consoli..."
D,"DOMINION ENERGY, INC",Utilities,4911,Electric Services,Regulated Electric Utility,Large accelerated filer,VA,2026-02-23,108453,"Dominion Energy, headquartered in Richmond, Virginia and incorporated in Virginia in 1983, provides service to approximately 4.1 million primarily electric utility customers in Virginia, North Carolina and South Carolina. At December 31, 2025, Dominion Energy's portfolio of assets includes approximately 30.7 GW of electric generating capacity, 10,800 miles of electric transmission lines and 80,400 miles of electric distribution lines."
DAL,"DELTA AIR LINES, INC.",Industrials,4512,"Air Transportation, Scheduled",,Large accelerated filer,DE,2026-02-11,60748,"As a global airline based in the United States, we connect customers across our expansive global network with a commitment to ensuring that the future of travel is connected, personalized and enjoyable. In 2025, we served over 200 million customers safely, reliably and with industry-leading customer service innovation."
DAN,DANA Inc,Consumer Cyclical,3714,Motor Vehicle Parts & Accessories,,Large accelerated filer,DE,2026-02-27,11714,"Forward-Looking Information Statements in this report (or otherwise made by us or on our behalf) that are not entirely historical constitute ""forward-looking statements"" within the meaning of the Private Securities Litigation Reform Act of 1995. Such forward-looking statements can often be identified by words such as ""anticipates,"" ""expects,"" ""believes,"" ""intends,"" ""plans,"" ""predicts,"" ""seeks,"" ""estimates,"" ""projects,"" ""outlook,"" ""may,"" ""will,"" ""should,"" ""would,"" ""could,"" ""potential,"" ""continue,..."
DAR,DARLING INGREDIENTS INC.,Consumer Defensive,2070,Fats & Oils,,Large accelerated filer,DE,2026-03-03,46609,"Founded by the Swift meat packing interests and the Darling family in 1882, Darling Ingredients Inc. (""Darling"", and together with its subsidiaries, the ""Company"" or ""we,"" ""us"" or ""our"") was incorporated in Delaware in 1962 under the name ""Darling-Delaware Company, Inc."" Darling changed its name from ""Darling-Delaware Company, Inc."" to ""Darling International Inc."" on December 28, 1993, and from ""Darling International Inc."" to ""Darling Ingredients Inc."" on May 6, 2014."
DASH,"DoorDash, Inc.",Consumer Cyclical,7389,"Services-Business Services, NEC",E-Commerce & Digital Marketplace,Large accelerated filer,DE,2026-02-18,24394,"SPECIAL NOTE REGARDING FORWARD-LOOKING STATEMENTS This Annual Report on Form 10-K contains forward-looking statements within the meaning of the federal securities laws, which statements involve substantial risks and uncertainties. Forward-looking statements generally relate to future events or our future financial or operating performance."
DAVE,Dave Inc./DE,Technology,6199,Finance Services,Specialty Finance & Credit,Large accelerated filer,,2026-03-02,79999,"On February 25, 2026, the Company's Board of Directors authorized a new share repurchase program to buy back up to $300 million of its outstanding Class A common stock. The new program replaces the existing share repurchase program, which provided for up to $125 million repurchasing authority. As of February 25, 2026, approximately $113.2 million remained available under the existing program."
DAWN,"Day One Biopharmaceuticals, Inc.",Healthcare,2834,Pharmaceutical Preparations,Oncology,Large accelerated filer,DE,2026-02-24,170809,"Day One Biopharmaceuticals, Inc., or the Company or Day One, is a biopharmaceutical company dedicated to developing and commercializing targeted therapies for people of all ages with life-threatening diseases. At Day One, we aim to identify and develop breakthrough medicines with the goal of improving the outcomes and life trajectories of patients of any age facing serious diseases starting from Day One."
DB,DEUTSCHE BANK AKTIENGESELLSCHAFT,Financial,6022,State Commercial Banks,,Large accelerated filer,,,0,
DBRG,"DigitalBridge Group, Inc.",Financial,6282,Investment Advice,Alternative Asset Management,Large accelerated filer,MD,2026-02-26,9027,"FORWARD-LOOKING STATEMENTS Some of the statements contained in this Annual Report on Form 10-K (this ""Annual Report"") constitute forward-looking statements within the meaning of the Private Securities Litigation Reform Act of 1995 and Section 21E of the Securities Exchange Act of 1934, as amended (the ""Exchange Act""), and we intend such statements to be covered by the safe harbor provisions contained therein."
DBX,"DROPBOX, INC.",Technology,7372,Services-Prepackaged Software,Enterprise & Vertical SaaS,Large accelerated filer,DE,2026-02-20,47026,"SPECIAL NOTE REGARDING FORWARD-LOOKING STATEMENTS This Annual Report on Form 10-K contains forward-looking statements within the meaning of Section 27A of the Securities Act of 1933, as amended (the ""Securities Act""), and Section 21E of the Securities Exchange Act of 1934, as amended (the ""Exchange Act""), which statements involve substantial risk and uncertainties. Forward-looking statements generally relate to future events or our future financial or operating performance."
DCI,DONALDSON Co INC,Industrials,3564,Industrial & Commercial Fans & Blowers & Air Purifing Equip,,Large accelerated filer,DE,2025-09-26,29166,"Founded in 1915, Donaldson Company, Inc. (the Company or Donaldson) is a global leader in technology-led filtration products and solutions, serving a broad range of industries and advanced markets. Donaldson's diverse and skilled employees at more than 150 locations on six continents, 77 of which are manufacturing and/or distribution centers, partner with customers from small business owners to the world's largest original equipment manufacturer (OEM) brands to solve complex filtration challenge..."
DD,"DuPont de Nemours, Inc.",Basic Materials,2821,"Plastic Materials, Synth Resins & Nonvulcan Elastomers",,Large accelerated filer,DE,2026-02-17,34009,"DuPont de Nemours, Inc. DuPontTM and all products, unless otherwise noted, denoted with TM, SM or are trademarks, service marks or registered trademarks of affiliates of DuPont de Nemours, Inc. FORWARD-LOOKING STATEMENTS Certain statements in this document may be considered forward-looking statements, within the meaning of the federal securities laws, including Section 27A of the Securities Act of 1933, as amended, and Section 21E of the Securities Exchange Act of 1934, as amended."
DDOG,"Datadog, Inc.",Technology,7372,Services-Prepackaged Software,Developer Tools & Data Platforms,Large accelerated filer,DE,2026-02-18,147775,"We may not successfully accomplish any of these objectives, and as a result, it is difficult for us to forecast our future results of operations. If the assumptions that we use to plan our business are incorrect or change in reaction to changes in our market, or if we are unable to maintain consistent revenue or revenue growth, our stock price could be volatile, and it may be difficult to achieve and maintain profitability."
DE,DEERE & CO,Industrials,3523,Farm Machinery & Equipment,,Large accelerated filer,DE,2025-12-18,2386,"This Annual Report on Form 10-K contains forward-looking statements that are subject to risks and uncertainties. All statements other than statements of historical fact included in this Annual Report on Form 10-K are forward-looking statements. Forward-looking statements provide our current expectations and projections relating to our financial condition, results of operations, plans, objectives, future performance, and business."
DECK,DECKERS OUTDOOR CORP,Consumer Cyclical,3021,Rubber & Plastics Footwear,,Large accelerated filer,DE,2025-05-23,31725,"We are a global leader in designing, marketing, and distributing innovative footwear, apparel, and accessories developed for both everyday casual lifestyle use and high-performance activities. We market our products primarily under five proprietary brands: UGG, HOKA, Teva, AHNU, and Koolaburra. Our brands compete across the fashion and casual lifestyle, performance, running, and outdoor markets. We believe our products are distinctive and appeal to a broad demographic."
DELL,Dell Technologies Inc.,Technology,3571,Electronic Computers,,Large accelerated filer,DE,2025-03-25,80000,"Manufacturing and Materials."" Because of the interrelation of the products and services offered in each of our segments, we generally do not designate our properties to any segment. With limited exceptions, each property is used at least in part by both of our segments, and we retain the flexibility to make future use of each of the properties available to each segment. We believe that our existing properties are suitable and adequate for our current needs."
DEO,DIAGEO PLC,Consumer Defensive,2080,Beverages,,Large accelerated filer,X0,,0,
DG,DOLLAR GENERAL CORP,Consumer Defensive,5331,Retail-Variety Stores,,Large accelerated filer,TN,2025-03-21,15460,"We are the largest discount retailer in the United States by number of stores, with 20,662 stores located in 48 U.S. states and Mexico as of February 28, 2025, with the greatest concentration of stores in the southern, southwestern, midwestern and eastern United States. Our first stores in Mexico opened in 2023. We offer a broad selection of merchandise, including consumable items, seasonal items, home products and apparel."
DGX,QUEST DIAGNOSTICS INC,Healthcare,8071,Services-Medical Laboratories,,Large accelerated filer,DE,2026-02-26,129869,"Quest Diagnostics works across the healthcare ecosystem to create a healthier world, one life at a time. We provide diagnostic insights from the results of our laboratory testing to empower people, physicians, and organizations to take action to improve health outcomes. Derived from one of the world's largest databases of de-identifiable clinical lab results, our diagnostic insights reveal new avenues to identify and treat disease, inspire healthy behaviors and improve healthcare management."
DHI,HORTON D R INC /DE/,Consumer Cyclical,1531,Operative Builders,,Large accelerated filer,DE,2025-11-19,41703,"D.R. Horton, Inc. is the largest homebuilding company in the United States as measured by number of homes closed. We construct and sell homes through our operating divisions in 126 markets across 36 states. Our common stock is included in the S&P 500 Index and listed on the New York Stock Exchange (NYSE) and NYSE Texas under the ticker symbol ""DHI."" Our listing on NYSE Texas became effective in June 2025. Unless the context otherwise requires, the terms ""D.R."
DHR,DANAHER CORP /DE/,Healthcare,3823,"Industrial Instruments For Measurement, Display, and Control",,Large accelerated filer,DE,2026-02-24,142937,"Our growth depends in part on the timely development and commercialization, and customer acceptance, of new and enhanced products and services based on technological innovation. We generally sell our products and services in industries that are characterized by rapid technological changes, frequent new product introductions and changing industry standards."
DHT,"DHT Holdings, Inc.",Energy,4412,Deep Sea Foreign Transportation of  Freight,,Large accelerated filer,1T,,0,
DINO,HF Sinclair Corp,Energy,4610,Pipe Lines (No Natural Gas),,Large accelerated filer,DE,2026-02-27,0,
DIS,Walt Disney Co,Communication Services,7990,Services-Miscellaneous Amusement & Recreation,,Large accelerated filer,DE,2025-11-13,62233,"Consolidated Financial Information The Walt Disney Company Cautionary Note on Forward-Looking Statements This Annual Report on Form 10-K contains forward-looking statements within the meaning of Section 27A of the Securities Act of 1933, as amended, and Section 21E of the Securities Exchange Act of 1934, as amended."
DJT,Trump Media & Technology Group Corp.,Communication Services,7370,"Services-Computer Programming, Data Processing, Etc.",Internet Platforms & Social Media,Large accelerated filer,FL,2026-02-27,72206,"Unless the context otherwise requires, throughout this Annual Report on Form 10-K, the words ""TMTG,"" ""we,"" ""us,"" ""our"" or the ""Company"" refer to Trump Media & Technology Group Corp. and its subsidiaries (as applicable). The mission of TMTG is to end Big Tech's assault on free speech by opening up the Internet and giving people their voices back."
DK,"Delek US Holdings, Inc.",Energy,2911,Petroleum Refining,Refining & Marketing,Large accelerated filer,DE,2026-02-27,0,
DKNG,DraftKings Inc.,Consumer Cyclical,7990,Services-Miscellaneous Amusement & Recreation,,Large accelerated filer,NV,2026-02-13,80000,"We are a digital sports entertainment and gaming company. We provide users with online and retail sports betting (together, ""Sportsbook""), online casino (""iGaming""), daily fantasy sports (""DFS""), digital lottery courier, prediction markets and other product offerings. Our mission is to make life more exciting by responsibly creating the world's favorite real-money games, betting experiences and event contracts trading."
DKS,"DICK'S SPORTING GOODS, INC.",Consumer Cyclical,5940,Retail-Miscellaneous Shopping Goods Stores,,Large accelerated filer,DE,2025-03-27,23714,"DICK'S Sporting Goods, Inc. (together with its subsidiaries, referred to as ""the Company"", ""we"", ""us"" and ""our"" unless specified otherwise) is a leading omni-channel sporting goods retailer offering an extensive assortment of authentic, high-quality sports equipment, apparel, footwear and accessories."
DLB,"Dolby Laboratories, Inc.",Industrials,6794,Patent Owners & Lessors,,Large accelerated filer,DE,2025-11-18,26240,"Founded in 1965, we are in the business of improving entertainment experiences by inventing and innovating technologies that advance audio and video capture, transmission, and playback. We enable highly compelling experiences in movies and TV shows, music, sports and more by meeting the needs of content creators, distributors, and consumer electronics manufacturers."
DLR,"DIGITAL REALTY TRUST, INC.",Real Estate,6798,Real Estate Investment Trusts,Data Center & Digital Infrastructure,Large accelerated filer,MD,2026-02-13,21967,"Index to Financial Statements Digital Realty Trust, Inc., through its controlling interest in Digital Realty Trust, L.P. and the subsidiaries of the Operating Partnership, is a leading global provider of data center, colocation and interconnection solutions for customers across a variety of industry verticals. The Parent operates as a REIT for U.S. federal income tax purposes."
DLTR,"DOLLAR TREE, INC.",Consumer Defensive,5331,Retail-Variety Stores,,Large accelerated filer,VA,2025-03-26,49723,"Our business could be adversely affected if we fail to manage our organizational talent and capacity, including attracting and retaining qualified associates and key personnel. Our growth and performance are dependent on the skills, experience and contributions of our associates, executives and key personnel."
DNLI,Denali Therapeutics Inc.,Healthcare,2836,"Biological Products, (No Diagnostic Substances)",Other Biologics,Large accelerated filer,DE,2026-02-26,203130,"Special Note Regarding Forward-Looking Statements This Annual Report on Form 10-K contains forward-looking statements. All statements other than statements of historical facts contained in this report, including statements regarding our future results of operations and financial position, business strategy, product candidates, planned preclinical studies and clinical trials, research and development costs, regulatory approvals, timing and likelihood of success, as well as plans and objectives of..."
DNOW,DNOW Inc.,Industrials,3533,Oil & Gas Field Machinery & Equipment,,Large accelerated filer,DE,2026-02-26,46210,"DNOW Inc., (""DNOW"" or the ""Company""), headquartered in Houston, Texas, was incorporated in Delaware on November 22, 2013. On June 2, 2014, DNOW stock began regular trading on the New York Stock Exchange under the ticker symbol ""DNOW"". We are a premier provider of energy and industrial solutions, serving as a global leader in the distribution of pipe, valves and fittings (""PVF""), and pumps, as well as in the fabrication, assembly and testing of process and production equipment."
DNTH,"Dianthus Therapeutics, Inc. /DE/",Healthcare,2834,Pharmaceutical Preparations,Immunology & Inflammation,Non-accelerated filer<br>Smaller reporting company,DE,2026-03-09,179241,"SPECIAL NOTE REGARDING FORWARD-LOOKING STATEMENTS This Annual Report on Form 10-K contains ""forward-looking statements"" within the meaning of the federal securities laws, which statements are subject to substantial risks and uncertainties and are based on estimates and assumptions."
DOC,"HEALTHPEAK PROPERTIES, INC.",Real Estate,6798,Real Estate Investment Trusts,Healthcare Facilities,Large accelerated filer,MD,2026-02-03,24247,"Healthpeak Properties, Inc. is a Standard & Poor's (""S&P"") 500 company that owns, operates, and develops high-quality real estate focused on healthcare discovery and delivery in the United States (""U.S.""). Our company was originally founded in 1985. We are organized as an umbrella partnership REIT (""UPREIT""). We hold substantially all of our assets and conduct our operations through our operating subsidiary, Healthpeak OP, a consolidated subsidiary of which we are the managing member."
DOCN,"DigitalOcean Holdings, Inc.",Technology,7370,"Services-Computer Programming, Data Processing, Etc.",Internet Platforms & Social Media,Large accelerated filer,DE,2026-02-24,44715,"Our mission is to empower AI-driven and digital-native businesses to build, run, and scale intelligent applications with speed, simplicity and predictable economics through an agentic inference cloud platform that reduces operational complexity and accelerates time to product. DigitalOcean is an agentic inference cloud platform that helps AI and Digital Native Enterprises build, run, and scale intelligent applications with speed, simplicity, and predictable economics."
DOCS,"Doximity, Inc.",Healthcare,7371,Services-Computer Programming Services,,Large accelerated filer,DE,2025-05-20,61274,"SPECIAL NOTE REGARDING FORWARD-LOOKING STATEMENTS This Annual Report on Form 10-K contains forward-looking statements within the meaning of the federal securities laws, which are statements that involve substantial risks and uncertainties. Forward-looking statements generally relate to future events or our future financial or operating performance."
DOCU,"DOCUSIGN, INC.",Technology,7372,Services-Prepackaged Software,Enterprise & Vertical SaaS,Large accelerated filer,DE,2025-03-18,45716,"Docusign, Inc. | 2025 Form 10-K | 2 NOTE REGARDING FORWARD-LOOKING STATEMENTS This Annual Report on Form 10-K contains forward-looking statements within the meaning of Section 27A of the Securities Act of 1933, as amended, and Section 21E of the Securities Exchange Act of 1934, as amended, which statements involve substantial risk and uncertainties."
DOV,DOVER Corp,Industrials,3530,"Construction, Mining & Materials Handling Machinery & Equip",,Large accelerated filer,NY,2026-02-13,54308,"Dover Corporation is a diversified global manufacturer and solutions provider delivering innovative equipment and components, consumable supplies, aftermarket parts, software and digital solutions and support services through five operating segments: Engineered Products, Clean Energy & Fueling, Imaging & Identification, Pumps & Process Solutions, and Climate & Sustainability Technologies."
DOW,DOW INC.,Basic Materials,2821,"Plastic Materials, Synth Resins & Nonvulcan Elastomers",,Large accelerated filer,DE,2026-02-03,80000,"Dow's measure of profit/loss for segment reporting purposes is Operating EBIT as this is the manner in which the chief executive officer, chief operating officer, chief financial officer, general counsel and corporate secretary, and senior vice president of corporate development, together the ""executive committee"" and chief operating decision maker (""CODM""), assesses performance and allocates resources."
DOX,AMDOCS LTD,Technology,7371,Services-Computer Programming Services,,Large accelerated filer,X0,,0,
DPZ,DOMINOS PIZZA INC,Consumer Cyclical,5140,Wholesale-Groceries & Related Products,,Large accelerated filer,DE,2026-02-23,48815,"Throughout this document, Domino's Pizza, Inc. (Nasdaq: DPZ) is referred to as the ""Company,"" ""Domino's,"" ""Domino's Pizza"" or in the first-person notations of ""we,"" ""us"" and ""our."" In this document, we rely on and refer to information regarding the U.S. quick service restaurant, or QSR, sector and the U.S."
DRI,DARDEN RESTAURANTS INC,Consumer Cyclical,5812,Retail-Eating  Places,,Large accelerated filer,FL,2025-07-18,45937,"Darden Restaurants, Inc. is a full-service restaurant company, and as of May 25, 2025, we owned and operated 2,159 restaurants through subsidiaries in the United States and Canada under the Olive Garden , LongHorn Steakhouse , Cheddar's Scratch Kitchen , Chuy's , Yard House , Ruth's Chris Steak House (""Ruth's Chris""), The Capital Grille , Seasons 52 , Eddie V's Prime Seafood (""Eddie V's""), Bahama Breeze , and The Capital Burger trademarks."
DRS,"Leonardo DRS, Inc.",Industrials,3812,"Search, Detection, Navigation, Guidance, Aeronautical Sys",,Large accelerated filer,DE,2026-02-27,39544,"SPECIAL NOTE REGARDING FORWARD-LOOKING STATEMENTS AND INFORMATION In this Annual Report on Form 10-K (this ""Annual Report""), when using the terms the ""Company"", ""DRS"", ""we"", ""us"" and ""our,"" unless otherwise indicated or the context otherwise requires, we are referring to Leonardo DRS, Inc. This Annual Report contains forward-looking statements and cautionary statements within the meaning of the Private Securities Litigation Reform Act of 1995."
DSGX,DESCARTES SYSTEMS GROUP INC,Technology,7372,Services-Prepackaged Software,Enterprise & Vertical SaaS,Smaller reporting company,A6,,0,
DT,"Dynatrace, Inc.",Technology,7372,Services-Prepackaged Software,Developer Tools & Data Platforms,Large accelerated filer,DE,2025-05-22,33942,"Dynatrace is advancing observability for today's digital businesses, helping to transform the complexity of modern digital ecosystems into powerful business assets. By leveraging AI-powered insights, Dynatrace enables organizations to analyze, automate, and innovate faster to drive their business forward. Our vision is a world where software works perfectly."
DTE,DTE ENERGY CO,Utilities,4911,Electric Services,Regulated Electric Utility,Large accelerated filer,MI,2026-02-17,0,
DTM,"DT Midstream, Inc.",Energy,4922,Natural Gas Transmission,,Large accelerated filer,DE,2026-02-19,0,
DUK,Duke Energy CORP,Utilities,4931,Electric & Other Services Combined,,Large accelerated filer,DE,2026-02-26,74057,"Duke Energy was incorporated on May 3, 2005, and is an energy company headquartered in Charlotte, North Carolina, subject to regulation by the FERC and other regulatory agencies listed below. Duke Energy operates in the U.S. primarily through its direct and indirect subsidiaries. Certain Duke Energy subsidiaries are also Subsidiary Registrants, including Duke Energy Carolinas, Progress Energy, Duke Energy Progress, Duke Energy Florida, Duke Energy Ohio, Duke Energy Indiana and Piedmont."
DUOL,"Duolingo, Inc.",Technology,7372,Services-Prepackaged Software,Other Software,Large accelerated filer,DE,2026-02-27,36778,"Our mission is to develop the best education in the world and make it universally available. Although education can open the door to economic opportunity, it is also among the principal sources of inequality: the privileged can get the best education in the world, while those with fewer resources, especially in developing countries, may not be able to get even basic schooling. That is why we started Duolingo."
DVA,DAVITA INC.,Healthcare,8090,"Services-Misc Health & Allied Services, NEC",,Large accelerated filer,DE,2026-02-11,28346,"Unless otherwise indicated in this report ""DaVita"", ""the Company"" ""we"", ""us"", ""our"" and other similar terms refer to DaVita Inc. and its consolidated subsidiaries. Our annual report on Form 10-K, quarterly reports on Form 10-Q, current reports on Form 8-K and amendments to those reports filed or furnished pursuant to section 13(a) or 15(d) of the Securities Exchange Act of 1934, as amended, are made available free of charge through our website, located at http://www.davita."
DVN,DEVON ENERGY CORP/DE,Energy,1311,Crude Petroleum & Natural Gas,E&P - Oil Focused,Large accelerated filer,DE,2026-02-18,0,
