ticker,company_name,sector,sic_code,sic_description,sub_label,category,state,filing_date,item1_length,business_summary
KRC,KILROY REALTY CORP,Real Estate,6798,Real Estate Investment Trusts,Office,Large accelerated filer,MD,2026-02-11,68422,"Real estate assets are illiquid, and we may not be able to sell our properties when we desire. Our investments in our properties are relatively illiquid, limiting our ability to sell our properties quickly in response to changes in economic or other conditions."
KRG,KITE REALTY GROUP TRUST,Real Estate,6798,Real Estate Investment Trusts,Retail,Large accelerated filer,MD,2026-02-17,41408,"Forward-Looking Statements This Annual Report on Form 10-K, together with other statements and information publicly disseminated by us, contains certain forward-looking statements within the meaning of Section 27A of the Securities Act of 1933 and Section 21E of the Securities Exchange Act of 1934."
KRMN,Karman Holdings Inc.,Industrials,3728,"Aircraft Parts & Auxiliary Equipment, NEC",,<br>Emerging growth company,DE,2025-04-10,55576,"BASIS OF PRESENTATION As used in this Annual Report on Form 10-K, unless the context otherwise requires, the ""Company,"" ""our company,"" ""Karman,"" ""we,"" ""us"" and ""our"" refer to TCFIII Spaceco Holdings LLC or Karman LLC and its consolidated subsidiaries for all periods prior to the Corporate Conversion discussed below and to Karman Holdings Inc. or Karman Holdco and its consolidated subsidiaries for all periods following the Corporate Conversion."
KSPI,Joint Stock Co Kaspi.kz,Technology,7389,"Services-Business Services, NEC",Financial & Payment Services,Non-accelerated filer,1P,,0,
KT,KT CORP,Communication Services,4813,Telephone Communications (No Radiotelephone),,Large accelerated filer,,,0,
KTB,"Kontoor Brands, Inc.",Consumer Cyclical,2320,"Men's & Boys' Furnishgs, Work Clothg, & Allied Garments",,Large accelerated filer,NC,2026-03-04,41968,"Kontoor Brands, Inc. (collectively with its subsidiaries, ""Kontoor,"" the ""Company,"" ""we,"" ""us"" or ""our"") is a global lifestyle apparel company, with a portfolio led by three of the world's most iconic consumer brands: Wrangler , Lee and Helly Hansen . The Company designs, manufactures, procures, sells and licenses apparel, footwear and accessories, primarily under the brand names Wrangler , Lee and Helly Hansen ."
KTOS,"KRATOS DEFENSE & SECURITY SOLUTIONS, INC.",Industrials,3760,Guided Missiles & Space Vehicles & Parts,,Large accelerated filer,DE,2026-02-23,75237,"Kratos is a technology, hardware, products, system and software company addressing the defense, national security, and commercial markets. Kratos makes true internally funded research, development, capital and other investments, to rapidly develop, produce and field relevant solutions that address our customers' mission critical needs and requirements."
KVUE,Kenvue Inc.,Consumer Defensive,2844,"Perfumes, Cosmetics & Other Toilet Preparations",,Large accelerated filer,DE,2026-02-20,2481,"At Kenvue, our purpose is to realize the extraordinary power of everyday care. As a global leader at the intersection of healthcare and consumer goods, we are the world's largest pure-play consumer health company by revenue with $15.1 billion in Net sales in the fiscal year 2025. By combining the power of science with meaningful consumer insights and our digital strategy, we empower consumers to live healthier lives every day."
KVYO,"Klaviyo, Inc.",Technology,7372,Services-Prepackaged Software,Enterprise & Vertical SaaS,Large accelerated filer,DE,2026-02-10,68798,"SPECIAL NOTE REGARDING FORWARD-LOOKING STATEMENTS This Annual Report on Form 10-K contains forward-looking statements within the meaning of the federal securities laws, which are statements that involve substantial risks and uncertainties. Forward-looking statements generally relate to future events or our future financial or operating performance."
KYIV,Kyivstar Group Ltd.,Communication Services,4812,Radiotelephone Communications,,,D0,,0,
KYMR,"Kymera Therapeutics, Inc.",Healthcare,2836,"Biological Products, (No Diagnostic Substances)",Other Biologics,Large accelerated filer,DE,2026-02-26,131268,"We are a clinical-stage biopharmaceutical company dedicated to reinventing the treatment of human disease through the development of innovative, highly differentiated oral medicines that address significant health problems and meaningfully improve patients' lives. We are committed to advancing novel technologies to address targets that have known disease-causing biology, but which have not been drugged, or have been inadequately drugged, often based on limitations of existing technologies."
L,LOEWS CORP,Financial,6331,"Fire, Marine & Casualty Insurance",P&C Insurance,Large accelerated filer,DE,2026-02-10,25042,"Loews Corporation was incorporated in 1969 and is a holding company. Our subsidiaries are engaged in the following lines of business: commercial property and casualty insurance (CNA Financial Corporation, an approximately 92% owned subsidiary); transportation and storage of natural gas and natural gas liquids, olefins and other hydrocarbons (Boardwalk Pipeline Partners, LP, a wholly owned subsidiary); and operation of a chain of hotels (Loews Hotels Holding Corporation, a wholly owned subsidiary..."
LAMR,LAMAR ADVERTISING CO/NEW,Real Estate,6798,Real Estate Investment Trusts,Specialty & Self-Storage,Large accelerated filer,DE,2026-02-20,37985,"Lamar Advertising Company is one of the largest outdoor advertising companies in the United States based on number of displays and has operated under the Lamar name since 1902. We manage our business through three operating segments billboard, logo and transit advertising. We rent space for advertising on billboards, buses, shelters, benches, logo plates and in airport terminals."
LASR,"NLIGHT, INC.",Technology,3674,Semiconductors & Related Devices,Optoelectronics & Laser,Large accelerated filer,DE,2026-02-27,25133,"nLIGHT, Inc. is a leading provider of high power lasers for mission-critical directed energy, optical sensing, and advanced manufacturing applications. We design, manufacture, and sell a range of high-power semiconductor lasers and fiber lasers that are typically integrated into laser systems or manufacturing tools built by our customers."
LAUR,"LAUREATE EDUCATION, INC.",Consumer Defensive,8200,Services-Educational Services,,Large accelerated filer,DE,2026-02-19,26213,"the risks associated with operating our portfolio of degree-granting higher education institutions in Mexico and Peru, including complex business, political, legal, regulatory, tax and economic risks; our ability to maintain and, subsequently, increase tuition rates and student enrollments in our institutions; our ability to effectively manage the growth of our business and increase our operating leverage; the risks associated with maintaining the value of our brands and our reputation; the effe..."
LAZ,"Lazard, Inc.",Financial,6282,Investment Advice,Financial Infrastructure & Data,Large accelerated filer,DE,2026-02-23,29988,"Founded in 1848, Lazard is a global financial advisory and asset management firm with operations in North and South America, Europe, the Middle East, Asia, and Australia. Lazard provides advice on mergers and acquisitions, capital markets and capital solutions, restructuring and liability management, geopolitics, and other strategic matters, as well as asset management and investment solutions to institutions, corporations, governments, partnerships, family offices, and high net worth individual..."
LB,LandBridge Co LLC,Energy,6792,Oil Royalty Traders,,Large accelerated filer<br>Smaller reporting company,DE,2026-02-26,105346,"LandBridge was formed on September 27, 2023 as a Delaware limited liability company to serve as the issuer in an initial public offering of equity, which closed on July 1, 2024 (the ""IPO""). LandBridge is a holding company, the principal asset of which is membership interests in OpCo. LandBridge is also the sole managing member of OpCo."
LBRDK,Liberty Broadband Corp,Communication Services,4841,Cable & Other Pay Television Services,,Large accelerated filer,,2026-02-05,96820,"General Development of Business Liberty Broadband Corporation (""Liberty Broadband,"" ""the Company,"" ""us,"" ""we,"" or ""our"") is primarily comprised of an equity method investment in Charter. During May 2014, the board of directors of Liberty Media Corporation and its subsidiaries (""Liberty"") authorized management to pursue a plan to spin-off to its stockholders common stock of a wholly owned subsidiary, Liberty Broadband, and to distribute subscription rights to acquire shares of Liberty Broadband's..."
LBRT,Liberty Energy Inc.,Energy,1389,"Oil & Gas Field Services, NEC",,Large accelerated filer,,2026-02-02,70251,"CAUTIONARY NOTE REGARDING FORWARD-LOOKING STATEMENTS This Annual Report on Form 10-K (""Annual Report"") and certain other communications made by us contain forward-looking statements within the meaning of Section 27A of the Securities Act of 1933, as amended (the ""Securities Act""), and Section 21E of the Securities Exchange of 1934, as amended (the ""Exchange Act""), including, among others, expected performance, expectations regarding the success of our distributed power business, future operating..."
LBTYA,Liberty Global Ltd.,Communication Services,4841,Cable & Other Pay Television Services,,Large accelerated filer,,2026-02-18,80000,"We cannot be certain that we will be successful with respect to acquisitions, dispositions, joint ventures, partnerships or other similar transactions, or that we will achieve the anticipated benefits thereof. Historically, our businesses have grown, in part, through selective acquisitions that enabled them to take advantage of existing networks, local service offerings and region-specific management expertise, and we have also taken advantage of attractive opportunities to sell select businesse..."
LCID,"Lucid Group, Inc.",Consumer Cyclical,3711,Motor Vehicles & Passenger Car Bodies,,Large accelerated filer,DE,2026-02-24,85126,"Lucid's mission is to advance the state-of-the-art of electric vehicle (""EV"") technology for the benefit of all. Lucid is a technology company that is shaping the future of mobility through its innovations, advanced technology, and software-defined vehicle platforms. The company's award-winning Lucid Air and Lucid Gravity set new standards with their unmatched combination of performance, range, space, and efficiency."
LDOS,"Leidos Holdings, Inc.",Technology,7373,Services-Computer Integrated Systems Design,IT Consulting & System Integration,Large accelerated filer,,2026-02-17,56962,"LEIDOS HOLDINGS, INC. FORM 10-K Forward-Looking Statements This Annual Report on Form 10-K contains forward-looking statements, within the meaning of the Private Securities Litigation Reform Act of 1995, that are based on our management's belief and assumptions about the future in light of information currently available to our management."
LEA,LEAR CORP,Consumer Cyclical,3714,Motor Vehicle Parts & Accessories,,Large accelerated filer,DE,2026-02-13,3191,"________________________ (1)Certain information is incorporated by reference, as indicated below, to the registrant's Definitive Proxy Statement on Schedule 14A for its Annual Meeting of Shareholders to be held in May 2026 (the ""Proxy Statement""). (2)A portion of the information required is incorporated by reference to the Proxy Statement sections entitled ""Election of Directors"" and ""Directors and Corporate Governance."
LEGN,Legend Biotech Corp,Healthcare,2834,Pharmaceutical Preparations,Rare Disease & Gene Therapy,Large accelerated filer,E9,,0,
LEN,LENNAR CORP /NEW/,Consumer Cyclical,1520,General Bldg Contractors - Residential Bldgs,,Large accelerated filer,DE,2026-01-28,54264,"Financial Statement Schedule98 Overview of Lennar Corporation We are one of the largest homebuilders in the United States by deliveries, revenues and net earnings, an originator of residential and commercial mortgage loans, a provider of title insurance and closing services and a developer of multifamily rental properties."
LEU,CENTRUS ENERGY CORP,Energy,1400,Mining & Quarrying of  Nonmetallic Minerals (No Fuels),,Large accelerated filer,DE,2026-02-11,18216,"Centrus Energy Corp., a Delaware corporation, is a trusted supplier of nuclear fuel components for the nuclear power industry, which provides a reliable source of carbon-free energy, and provides enrichment and technical services for public and private customers. References to ""Centrus"", the ""Company"", ""our"", or ""we"" include Centrus Energy Corp. and its wholly-owned subsidiaries as well as the predecessor to Centrus, unless the context indicates otherwise."
LEVI,LEVI STRAUSS & CO,Consumer Cyclical,2300,Apparel & Other Finishd Prods of  Fabrics & Similar Matl,,Large accelerated filer,DE,2026-01-28,33734,"From our California Gold Rush beginnings, we have grown into one of the world's largest brand-name apparel companies. A history of responsible business practices, rooted in our core values, has helped us build our brands and engender consumer trust around the world."
LFST,"LifeStance Health Group, Inc.",Healthcare,8000,Services-Health Services,,Large accelerated filer,DE,2026-02-25,69446,"Unless stated otherwise or the context otherwise requires, the terms ""we,"" ""us,"" ""our,"" ""our business,"" ""LifeStance"" and ""our Company"" and similar references refer to LifeStance Health Group, Inc. and its consolidated subsidiaries and supported practices. References to ""our employees"" and ""our clinicians"" refer collectively to employees and clinicians, respectively, of our subsidiaries and supported practices. References to ""our patients"" refer to the patients treated by such clinicians."
LGN,Legence Corp.,Industrials,1700,Construction - Special Trade Contractors,,Non-accelerated filer,DE,,0,
LH,LABCORP HOLDINGS INC.,Healthcare,8071,Services-Medical Laboratories,,Large accelerated filer,,2026-02-24,81044,"Index to Consolidated Financial Statements COMMONLY USED ABBREVIATIONS The abbreviations listed below may be commonly used in this report. ACAAffordable Care ActHHSU.S. Department of Health and Human Services ACOaccountable care organizationHIPAAU.S. Health Insurance Portability and Accountability Act of 1996, HITECH, and their implementing privacy, security, and breach notification regulations AIartificial intelligenceHITECHU.S."
LHX,"L3HARRIS TECHNOLOGIES, INC. /DE/",Industrials,3812,"Search, Detection, Navigation, Guidance, Aeronautical Sys",,Large accelerated filer,DE,2026-02-12,197739,"CS. Our CS segment includes software defined communication products and waveforms for domestic and international customers; broadband communications; integrated vision solutions; and public safety radios, system applications and equipment. (Dollars in millions)20252024% Inc/(Dec) Revenue$5,673 $5,459 4% Operating income1,432 1,324 8% Operating margin25.2 %24."
LI,Li Auto Inc.,Consumer Cyclical,3711,Motor Vehicles & Passenger Car Bodies,,Large accelerated filer,E9,,0,
LIF,"Life360, Inc.",Technology,7374,Services-Computer Processing & Data Preparation,Vertical Software & SaaS,Large accelerated filer,DE,2026-03-02,19578,"Life360 is a leading technology platform connecting millions of people throughout the world to the people, pets and things they care about most. We have created a new category at the intersection of family, technology, and safety to help keep families connected and safe. Our core offering, the Life360 mobile application, includes features like communications, driving safety, digital safety and location sharing."
LIN,LINDE PLC,Basic Materials,2810,Industrial Inorganic Chemicals,,Large accelerated filer,L2,2026-02-25,9321,Linde plc is a public limited company formed under the laws of Ireland with its principal offices in the United Kingdom and United States. Linde is the largest industrial gas company worldwide and is a major technological innovator in the industrial gases industry.
LINE,"Lineage, Inc.",Real Estate,6798,Real Estate Investment Trusts,Industrial & Logistics,Large accelerated filer,MD,2026-02-25,73237,"Forward-Looking Statements This Annual Report on Form 10-K contains forward-looking statements as defined by the Private Securities Litigation Reform Act of 1995. In particular, statements pertaining to our business and growth strategies, investment and development activities and trends in our business, contain forward-looking statements."
LITE,Lumentum Holdings Inc.,Technology,3669,"Communications Equipment, NEC",,Large accelerated filer,DE,2025-08-19,10507,"Lumentum Holdings Inc. (""we,"" ""us,"" ""our"", ""Lumentum"" or the ""Company"") is a leading provider of optical and photonic products and is recognized as an industry leader based on revenue and market share. Our products are essential to a range of cloud, artificial intelligence and machine learning (""AI/ML""), telecommunications, consumer, and industrial end-market applications. We operate in two end-market focused reportable segments, Cloud & Networking and Industrial Tech."
LIVN,LivaNova PLC,Healthcare,3845,Electromedical & Electrotherapeutic Apparatus,,Large accelerated filer,X0,2026-02-25,23875,"Results of Operations The following table presents LivaNova's annual consolidated results of operations (in thousands): Net revenue$1,388,053 $1,253,437 $1,153,545 448,183 399,953 397,725 939,870 853,484 755,820 Selling, general, and administrative (1) 548,813 508,876 502,699 Research and development185,764 182,514 193,817 Impairment of long-lived assets 89,974 Other operating expense5,903 33,043 37,828 Operating income (loss)199,390 129,051 (68,498) SNIA environmental liability expense(365,553)..."
LKQ,LKQ CORP,Consumer Cyclical,5010,Wholesale-Motor Vehicles & Motor Vehicle Parts & Supplies,,Large accelerated filer,DE,2026-02-19,35651,"SPECIAL NOTE ON FORWARD-LOOKING STATEMENTS Statements and information in this Annual Report on Form 10-K that are not historical are forward-looking statements within the meaning of the Private Securities Litigation Reform Act of 1995 and are made pursuant to the ""safe harbor"" provisions of such Act. Forward-looking statements include, but are not limited to, statements regarding our outlook, guidance, expectations, beliefs, hopes, intentions and strategies."
LLY,ELI LILLY & Co,Healthcare,2834,Pharmaceutical Preparations,Large Cap Pharma,Large accelerated filer,IN,2026-02-12,10067,"Eli Lilly and Company (referred to as the company, Lilly, we, or us) was incorporated in 1901 in Indiana to succeed to the drug manufacturing business founded in Indianapolis, Indiana, in 1876 by Colonel Eli Lilly. We discover, develop, manufacture, and market products in a single business segment human pharmaceutical products. Our purpose is to unite caring with discovery to create medicines that make life better for people around the world."
LMND,"Lemonade, Inc.",Financial,6331,"Fire, Marine & Casualty Insurance",P&C Insurance,Large accelerated filer,DE,2026-02-25,74750,"Lemonade is rebuilding insurance from the ground up on a digital substrate and an innovative business model. By leveraging technology, data, artificial intelligence, contemporary design, and social impact, we believe we are making insurance more delightful, more affordable, and more precise. To that end, we have built a vertically-integrated company with wholly-owned insurance carriers in the United States and Europe, including the UK, and the full technology stack to power them."
LMT,LOCKHEED MARTIN CORP,Industrials,3760,Guided Missiles & Space Vehicles & Parts,,Large accelerated filer,MD,2026-01-29,5695,"We are a global aerospace and defense technology company that builds and sustains the solutions America and its allies need to deter conflict and advance national security and scientific exploration objectives. Our four business areas Aeronautics, Missiles and Fire Control, Rotary and Mission Systems, and Space work as one company offering integrated solutions, at scale, across all warfighting domains."
LNC,LINCOLN NATIONAL CORP,Financial,6311,Life Insurance,Life & Annuity Insurance,Large accelerated filer,IN,2026-02-19,81945,"Insurance regulators and the NAIC regularly re-examine existing laws and regulations applicable to insurance companies and their products. Changes in these laws and regulations, or in interpretations thereof, sometimes lead to changes in business practices or additional expense, statutory reserves and/or RBC requirements for the insurer and, thus, could have a material adverse effect on our financial condition and results of operations."
LNG,"Cheniere Energy, Inc.",Energy,4924,Natural Gas Distribution,,Large accelerated filer,DE,2026-02-26,0,
LNT,ALLIANT ENERGY CORP,Utilities,4931,Electric & Other Services Combined,,Large accelerated filer,WI,2026-02-20,54872,"Alliant Energy maintains its principal executive offices in Madison, Wisconsin. Alliant Energy operates as a regulated investor-owned public utility holding company, and its purpose-driven strategy is to serve its customers and build stronger communities. Alliant Energy's primary focus is to provide regulated electric and natural gas service to approximately 1,010,000 electric and approximately 435,000 natural gas customers in the Midwest through its two public utility subsidiaries, IPL and WPL."
LNTH,"Lantheus Holdings, Inc.",Healthcare,2835,In Vitro & In Vivo Diagnostic Substances,,Large accelerated filer,DE,2026-02-26,26816,"We are the leading radiopharmaceutical-focused company committed to enabling clinicians to Find, Fight and Follow disease to deliver better patient outcomes. We classify our products into three product categories: Radiopharmaceutical Oncology, Precision Diagnostics, and Strategic Partnerships and Other Revenue. Our Radiopharmaceutical Oncology product helps healthcare professionals (""HCPs"") Find, Fight and Follow cancer. Our Precision Diagnostic products assist HCPs to Find and Follow diseases."
LOAR,Loar Holdings Inc.,Industrials,3728,"Aircraft Parts & Auxiliary Equipment, NEC",,Large accelerated filer,DE,2026-03-02,50916,"Special Note Regarding Forward-Looking Statements and Certain Definitions This Annual Report on Form 10-K includes express or implied forward-looking statements. Forward-looking statements include all statements that are not historical facts including those that reflect our current views with respect to, among other things, our operations and financial performance."
LOGI,LOGITECH INTERNATIONAL S.A.,Technology,3577,"Computer Peripheral Equipment, NEC",,Large accelerated filer,,2025-05-23,27107,"Founded in 1981, and headquartered in Lausanne, Switzerland, Logitech International is a Swiss public company listed on the SIX Swiss Exchange (LOGN) and on the Nasdaq Global Select Market (LOGI). Logitech's website address is www.logitech.com. Logitech designs software-enabled hardware solutions that help businesses thrive and bring people together when working, creating and gaming."
LOW,LOWES COMPANIES INC,Consumer Cyclical,5211,Retail-Lumber & Other Building Materials Dealers,,Large accelerated filer,NC,2025-03-24,5267,"Lowe's Companies, Inc. and subsidiaries (the Company or Lowe's) is a Fortune 50 company and the world's second largest home improvement retailer. As of January 31, 2025, Lowe's operated 1,748 home improvement stores and outlets in the United States, representing approximately 195 million square feet of retail selling space. Lowe's was founded in 1921 with the opening of its first hardware store in North Wilkesboro, North Carolina."
LPLA,LPL Financial Holdings Inc.,Financial,6200,"Security & Commodity Brokers, Dealers, Exchanges & Services",,Large accelerated filer,DE,2026-02-23,57403,"LPL serves the financial advisor-mediated marketplace as the nation's largest independent broker-dealer, a leading investment advisory firm, and a top custodian. We support more than 32,000 financial advisors, and the wealth management practices of approximately 1,200 financial institutions, servicing and custodying approximately $2.4 trillion in brokerage and advisory assets."
LPX,LOUISIANA-PACIFIC CORP,Industrials,2400,Lumber & Wood Products (No Furniture),,Large accelerated filer,DE,2026-02-17,15613,"We are a leading provider of high-performance building solutions that meet the demands of builders, remodelers, and homeowners worldwide. Serving the new home construction, repair and remodeling, and outdoor structures markets, we have leveraged our expertise to become an industry leader known for innovation, quality, reliability, and sustainability."
LQDA,Liquidia Corp,Healthcare,2834,Pharmaceutical Preparations,Rare Disease & Gene Therapy,Non-accelerated filer<br>Smaller reporting company,DE,2026-03-05,148637,"This Annual Report on Form 10-K includes our trademarks, trade names and service marks, such as Liquidia, the Liquidia logo, YUTREPIA and PRINT, which are protected under applicable intellectual property laws and are the property of Liquidia Technologies, Inc. This Annual Report on Form 10-K also contains trademarks, trade names and service marks of other companies, which are the property of their respective owners."
LRCX,LAM RESEARCH CORP,Technology,3559,"Special Industry Machinery, NEC",,Large accelerated filer,DE,2025-08-11,27435,"Incorporated in 1980, Lam Research Corporation (""Lam Research,"" ""Lam,"" ""we,"" ""our,"" ""us,"" or the ""Company"") is a Delaware corporation, headquartered in Fremont, California. We maintain a network of facilities throughout Asia, Europe, and the United States in order to meet the needs of our dynamic customer base. Additional information about Lam Research is available on our website at www.lamresearch.com."
