ticker,company_name,sector,sic_code,sic_description,sub_label,category,state,filing_date,item1_length,business_summary
RLI,RLI CORP,Financial,6331,"Fire, Marine & Casualty Insurance",P&C Insurance,Large accelerated filer,DE,2026-02-20,58329,"Annual Report on Form 10-K For the Fiscal Year Ended December 31, 2025 RLI Corp. was founded in 1965. References to ""the Company,"" ""we,"" ""our,"" ""us"" or like terms refer to the business of RLI Corp. and its subsidiaries. We underwrite select property, casualty and surety products through major subsidiaries collectively known as RLI Insurance Group. We conduct operations through three insurance companies. RLI Insurance Company (RLI Ins.), a subsidiary of RLI Corp."
RMBS,RAMBUS INC,Technology,3674,Semiconductors & Related Devices,Memory & Storage ICs,Large accelerated filer,DE,2026-02-18,16974,"Rambus is a global semiconductor company providing industry-leading chips and silicon IP for data-intensive computing systems, focusing on data center and artificial intelligence (""AI"") infrastructure. As a pioneer with over three decades of advanced semiconductor design experience, Rambus is at the forefront of enabling the next era of AI-driven computing, addressing the critical challenges of signal and power integrity at increasingly extreme data rates in the data center, edge and client mark..."
RMD,RESMED INC,Healthcare,3841,Surgical & Medical Instruments & Apparatus,Instruments & Supplies,Large accelerated filer,DE,2025-08-08,114857,"We are a global leader in digital health and cloud-connected medical devices. We design innovative solutions to treat and keep people out of the hospital, empowering them to live healthier, higher-quality lives. Our digital health technologies and cloud-connected medical devices transform care for people with sleep apnea, chronic obstructive pulmonary disease, or COPD, and other chronic diseases."
RNG,"RingCentral, Inc.",Technology,7374,Services-Computer Processing & Data Preparation,Vertical Software & SaaS,Large accelerated filer,,2026-02-27,38195,"SPECIAL NOTE REGARDING FORWARD-LOOKING STATEMENTS This Annual Report on Form 10-K contains forward-looking statements that are based on our management's beliefs and assumptions and on information currently available to our management. The forward-looking statements are contained principally in, but not limited to, the sections entitled ""Risk Factors"" and ""Management's Discussion and Analysis of Financial Condition and Results of Operations""."
ROAD,"Construction Partners, Inc.",Industrials,1600,Heavy Construction Other Than Bldg Const - Contractors,,Large accelerated filer,DE,2025-11-25,39704,"Unresolved Staff Comments Mine Safety Disclosures Market for Registrant's Common Equity, Related Stockholder Matters and Issuer Purchases of Equity Securities Management's Discussion and Analysis of Financial Condition and Results of Operations Quantitative and Qualitative Disclosures About Market Risk Financial Statements and Supplementary Data Changes in and Disagreements With Accountants on Accounting and Financial Disclosure Controls and Procedures Disclosure Regarding Foreign Jurisdictions ..."
ROIV,Roivant Sciences Ltd.,Healthcare,2834,Pharmaceutical Preparations,Other Therapeutics,Large accelerated filer,D0,2025-05-29,220140,"References to ""Roivant,"" the ""Company,"" ""we,"" ""us"" or ""our"" in the following section refer to Roivant Sciences Ltd. and its consolidated subsidiaries, unless the context otherwise requires. Roivant is a biopharmaceutical company that aims to improve the lives of patients by accelerating the development and commercialization of medicines that matter."
ROK,"ROCKWELL AUTOMATION, INC",Industrials,3829,"Measuring & Controlling Devices, NEC",,Large accelerated filer,DE,2025-11-12,4926,"FORWARD-LOOKING STATEMENTS This Annual Report on Form 10-K contains statements (including certain projections and business trends) that are ""forward-looking statements"" as defined in the Private Securities Litigation Reform Act of 1995. Words such as ""believe"", ""estimate"", ""project"", ""plan"", ""expect"", ""anticipate"", ""will"", ""intend"", and other similar expressions may identify forward-looking statements."
ROKU,"ROKU, INC",Communication Services,4841,Cable & Other Pay Television Services,,Large accelerated filer,DE,2026-02-13,45629,"GLOSSARY OF SELECTED TERMS As used in this Annual Report on Form 10-K (""Annual Report""), unless the context otherwise requires, references to the following terms have the respective meaning as defined below. Ad-supported Video on Demand (AVOD): Streaming on-demand content supported by advertising that does not charge a fee to the viewer. Apps: Primarily refers to the direct-to-consumer streaming applications on the Roku platform (e.g., The Roku Channel or Netflix)."
ROL,ROLLINS INC,Consumer Cyclical,7340,Services-To Dwellings & Other Buildings,,Large accelerated filer,DE,2026-02-12,102235,"Unresolved Staff Comments. Mine Safety Disclosures. Market for Registrant's Common Equity, Related Stockholder Matters and Issuer Purchases of Equity Securities. Management's Discussion and Analysis of Financial Condition and Results of Operations. Quantitative and Qualitative Disclosures about Market Risk. Financial Statements and Supplementary Data. Changes in and Disagreements with Accountants on Accounting and Financial Disclosures. Controls and Procedures."
ROP,ROPER TECHNOLOGIES INC,Technology,3823,"Industrial Instruments For Measurement, Display, and Control",,Large accelerated filer,DE,2026-02-24,12169,"All currency amounts are in millions unless specified Roper Technologies, Inc. (""Roper,"" the ""Company,"" ""we,"" ""our,"" or ""us"") is a diversified technology company. Roper has a proven, long-term, successful track record of compounding cash flow and increasing shareholder value. We operate market leading businesses that design and develop vertical software and technology enabled products for a variety of defensible niche markets."
ROST,"ROSS STORES, INC.",Consumer Cyclical,5651,Retail-Family Clothing Stores,,Large accelerated filer,DE,2025-04-01,34585,"The following table summarizes the locations of our stores by state/territory as of February 1, 2025 and February 3, 2024. State/TerritoryFebruary 1, 2025February 3, 2024 District of Columbia2 2 Where possible, we obtain sites in buildings requiring minimal alterations, allowing us to establish stores in new locations in a relatively short period of time and at reasonable costs in a given market. Nearly all of our stores are leased."
RPM,RPM INTERNATIONAL INC/DE/,Basic Materials,2851,"Paints, Varnishes, Lacquers, Enamels & Allied Prods",,Large accelerated filer,DE,2025-07-24,79999,"As permitted by Securities and Exchange Commission Rules and given the size of our operations, we have elected to adopt a quantitative disclosure threshold for environmental proceedings of $1.0 million. On December 19, 2024, a subsidiary in our Consumer segment received informal notification from the U.S."
RPRX,Royalty Pharma plc,Healthcare,2834,Pharmaceutical Preparations,Other Therapeutics,Large accelerated filer,X0,2026-02-11,27152,"We are the largest buyer of biopharmaceutical royalties and a leading funder of innovation across the biopharmaceutical industry. Since our founding in 1996, we have been pioneers in the royalty market, collaborating with innovators from academic institutions, research hospitals and not-for-profits through small and mid-cap biotechnology companies to leading global pharmaceutical companies."
RRC,RANGE RESOURCES CORP,Energy,1311,Crude Petroleum & Natural Gas,E&P - Gas & Diversified,Large accelerated filer,DE,2026-02-24,0,
RRR,"Red Rock Resorts, Inc.",Consumer Cyclical,7011,Hotels & Motels,Resorts & Casinos,Large accelerated filer,DE,2026-02-20,79999,"The gaming industry represents a significant source of tax revenue, particularly to the State of Nevada and its counties and municipalities. From time to time, various state and federal legislators and officials have proposed changes in tax law, or in the administration of such law, affecting the gaming industry. The Nevada legislature meets every two years for 120 days and when special sessions are called by the Governor. The most recent legislative session ended on November 19, 2025."
RRX,REGAL REXNORD CORP,Industrials,3569,"General Industrial Machinery & Equipment, NEC",,Large accelerated filer,WI,2026-02-20,33197,"Regal Rexnord Corporation (NYSE: RRX) (""we,"" ""us,"" ""our"" or the ""Company"") and its associates around the world help create a better tomorrow by providing sustainable solutions that power, transmit and control motion. The Company's electric motors and air moving subsystems provide the power to create motion. A portfolio of highly engineered power transmission components and subsystems efficiently transmits motion to power industrial applications."
RSG,"REPUBLIC SERVICES, INC.",Industrials,4953,Refuse Systems,,Large accelerated filer,DE,2026-02-18,71755,"Unless the context requires otherwise, all references in this Form 10-K to Republic, Republic Services, the Company, we, us and our refer to Republic Services, Inc. and its consolidated subsidiaries. Republic Services is one of the largest providers of environmental services in North America, as measured by revenue."
RSI,"Rush Street Interactive, Inc.",Consumer Cyclical,7990,Services-Miscellaneous Amusement & Recreation,,Large accelerated filer,DE,2026-02-18,29759,"Cautionary Note Regarding Forward-Looking Statements This Annual Report on Form 10-K (this ""Annual Report"") contains forward-looking statements within the meaning of the ""safe harbor"" provisions of the Private Securities Litigation Reform Act of 1995 that reflect future plans, estimates, beliefs and expected performance. The forward-looking statements depend upon events, risks and uncertainties that may be outside of our control."
RTO,RENTOKIL INITIAL PLC /FI,Industrials,8741,Services-Management Services,,Large accelerated filer,X0,,0,
RTX,RTX Corp,Industrials,3724,Aircraft Engines & Engine Parts,,Large accelerated filer,DE,2026-02-06,24873,"RTX Corporation and its subsidiaries' names, abbreviations thereof, logos, and products and services designators are all either the registered or unregistered trademarks or tradenames of RTX Corporation and its subsidiaries. Names, abbreviations of names, logos, and products and services designators of other companies are either the registered or unregistered trademarks or tradenames of their respective owners. References to internet web sites in this Form 10-K are provided for convenience only."
RUN,Sunrun Inc.,Technology,3690,"Miscellaneous Electrical Machinery, Equipment & Supplies",,Large accelerated filer,DE,2026-02-26,17792,"Sunrun's (the ""Company,"" ""our,"" ""we"") mission is to connect people to the cleanest energy on earth. Sunrun transformed the solar industry in 2007 by removing financial barriers and democratizing access to locally-generated, renewable energy. Today, Sunrun is the nation's leading provider of clean energy as a subscription service, offering residential solar and storage with no upfront costs."
RUSHA,RUSH ENTERPRISES INC \TX\,Consumer Cyclical,5500,Retail-Auto Dealers & Gasoline Stations,,Large accelerated filer,TX,2026-02-25,80000,"We lease a hangar in New Braunfels, Texas for our corporate aircraft. We also own and operate a guest ranch of approximately 10,950 acres near Cotulla, Texas, which is used for client development purposes. From time to time, we are involved in litigation arising out of our operations in the ordinary course of business."
RVMD,"Revolution Medicines, Inc.",Healthcare,2836,"Biological Products, (No Diagnostic Substances)",Oncology Biologics,Large accelerated filer,DE,2026-02-25,116988,"SPECIAL NOTE REGARDING FORWARD-LOOKING STATEMENTS This Annual Report on Form 10-K contains forward-looking statements concerning our business, operations and financial performance and condition, as well as our plans, objectives and expectations for our business, operations and financial performance and condition. Any statements contained herein that are not statements of historical facts may be deemed to be forward-looking statements."
RVTY,"REVVITY, INC.",Healthcare,3826,Laboratory Analytical Instruments,,Large accelerated filer,MA,2026-02-24,44283,"We are a leading provider of health science solutions, technologies, expertise and services that deliver complete workflows from discovery to development, and diagnosis to cure. Revvity is revolutionizing what's possible in healthcare, with specialized focus areas in translational multi-omics technologies, biomarker identification, imaging, prediction, screening, detection and diagnosis, informatics and more."
RY,ROYAL BANK OF CANADA,Financial,6029,"Commercial Banks, NEC",Money Center & Diversified Banks,,A6,,0,
RYAAY,RYANAIR HOLDINGS PLC,Industrials,4512,"Air Transportation, Scheduled",,Large accelerated filer,,,0,
RYAN,"RYAN SPECIALTY HOLDINGS, INC.",Financial,6411,"Insurance Agents, Brokers & Service",,Large accelerated filer,DE,2026-02-13,71349,"Founded by Patrick G. Ryan in 2010, Ryan Specialty is an international specialty insurance intermediary that provides specialty products, solutions, and services for insurance brokers, agents, and carriers. We provide distribution, underwriting, product development, administration, and risk management services through our wholesale brokerage platform and, on behalf of insurance carriers, through delegated underwriting authority via our managing underwriter, binding authority, and national progra..."
RYN,RAYONIER INC,Real Estate,6798,Real Estate Investment Trusts,Specialty & Self-Storage,Large accelerated filer,NC,2026-02-23,38360,"Significant assumptions and estimates are used in the recording of timber inventory and depletion costs. Factors that can impact timber volume include weather changes, losses due to natural causes, differences in actual versus estimated growth rates, and changes in the age when timber is considered merchantable. A 3% company-wide change in estimated standing merchantable inventory would have caused an estimated change of approximately $2.9 million to 2025 depletion expense."
RYTM,"RHYTHM PHARMACEUTICALS, INC.",Healthcare,2834,Pharmaceutical Preparations,Rare Disease & Gene Therapy,Large accelerated filer,DE,2026-02-26,96073,"We are a global, commercial-stage biopharmaceutical company dedicated to transforming the lives of patients living with rare neuroendocrine diseases. We are focused on advancing melanocortin-4 receptor (MC4R) agonists, including our lead asset, IMCIVREE (setmelanotide), as precision medicines designed to treat hyperphagia and severe obesity caused by rare MC4R pathway diseases."
S,"SentinelOne, Inc.",Technology,7372,Services-Prepackaged Software,Cybersecurity,Large accelerated filer,DE,2025-03-26,79220,"Special Note About Forward-Looking Statements This Annual Report on Form 10-K contains forward-looking statements within the meaning of Section 27A of the Securities Act of 1933, as amended (the Securities Act), and Section 21E of the Securities Exchange Act of 1934, as amended (the Exchange Act), about us and our industry that involve substantial risks and uncertainties."
SA,SEABRIDGE GOLD INC,Basic Materials,1040,Gold and Silver Ores,Gold Mining,Non-accelerated filer,A6,,0,
SAIA,SAIA INC,Industrials,4213,Trucking (No Local),,Large accelerated filer,DE,2026-02-24,37609,"Saia, Inc., through its wholly-owned subsidiaries, is a transportation company headquartered in Johns Creek, Georgia (Saia, Inc. together with its subsidiaries, the Company or Saia). We provide national less-than-truckload (LTL) services through a single integrated organization."
SAIC,Science Applications International Corp,Technology,7373,Services-Computer Integrated Systems Design,IT Consulting & System Integration,Large accelerated filer,DE,2025-03-17,17894,"Index to Consolidated Financial Statements SCIENCE APPLICATIONS INTERNATIONAL CORPORATION Science Applications International Corporation (herein referred to as ""SAIC,"" the ""Company,"" ""we,"" ""us,"" or ""our"") is a leading provider of technical, engineering and enterprise information technology (""IT"") services primarily to the U.S. government."
SAIL,"SailPoint, Inc.",Technology,7372,Services-Prepackaged Software,Cybersecurity,Non-accelerated filer,DE,2025-03-27,52687,"SailPoint, Inc. (together with its consolidated subsidiaries, as appropriate, ""SailPoint,"" the ""Company,"" ""our"" or ""we"") delivers solutions to enable comprehensive identity security for the enterprise. We do this by unifying identity data across systems and identity types, including employee identities, non-employee identities, and machine identities."
SAN,"Banco Santander, S.A.",Financial,6029,"Commercial Banks, NEC",Money Center & Diversified Banks,Large accelerated filer,U3,,0,
SANM,SANMINA CORP,Technology,3672,Printed Circuit Boards,,Large accelerated filer,DE,2025-11-13,57972,"Sanmina Corporation (""we"" or ""Sanmina"" or the ""Company"") is a leading global provider of integrated manufacturing solutions, components, products and repair, logistics and after-market services. We provide these comprehensive offerings primarily to original equipment manufacturers (""OEMs"") in the following industries: industrial, medical, defense and aerospace, automotive, communications networks and cloud infrastructure."
SAP,SAP SE,Technology,7372,Services-Prepackaged Software,Enterprise & Vertical SaaS,Large accelerated filer,2M,,0,
SARO,"StandardAero, Inc.",Industrials,3724,Aircraft Engines & Engine Parts,,Large accelerated filer,DE,2026-02-26,11052,"Basis of Presentation We manage our business in line with our service offerings with our reportable segments being Engine Services and Component Repair Services. Our Engine Services segment provides a full suite of aftermarket services, including maintenance, repair and overhaul, on-wing and field service support, asset management, and engineering and related solutions primarily in support of gas turbine engines across the commercial aerospace, military and helicopter, and business aviation end ..."
SATS,EchoStar CORP,Communication Services,4899,"Communications Services, NEC",,Large accelerated filer,NV,2026-03-02,56663,"If our products contain defects, we could be subject to significant costs to correct such defects and our product and network service contracts could be delayed or cancelled, which could adversely affect our revenue. Our products and networks we deploy are highly complex, and some may contain defects when first introduced or when new versions or enhancements are released, despite testing and our quality control procedures."
SBAC,SBA COMMUNICATIONS CORP,Real Estate,6798,Real Estate Investment Trusts,Data Center & Digital Infrastructure,Large accelerated filer,FL,2026-02-27,36891,"We are a leading independent owner and operator of wireless communications infrastructure, including tower structures, rooftops, and other structures that support antennas used for wireless communications, which we collectively refer to as ""towers"" or ""sites."" Our principal operations are in the United States and its territories. In addition, we own and operate towers in South America, Central America, and Africa."
SBLK,Star Bulk Carriers Corp.,Industrials,4412,Deep Sea Foreign Transportation of  Freight,,Large accelerated filer,1T,,0,
SBRA,"Sabra Health Care REIT, Inc.",Real Estate,6798,Real Estate Investment Trusts,Healthcare Facilities,Large accelerated filer,MD,2026-02-12,45577,"We operate as a self-administered, self-managed REIT that, through our subsidiaries, owns and invests in real estate serving the healthcare industry. Our primary business consists of acquiring, financing and owning real estate property to be leased to third-party tenants in the healthcare sector. We primarily generate revenues by leasing properties to tenants and owning properties operated by third-party property managers throughout the United States (""U.S."") and Canada."
SBS,COMPANHIA DE SANEAMENTO BASICO DO ESTADO DE SAO PAULO-SABESP,Utilities,4941,Water Supply,,Large accelerated filer,D5,,0,
SBSW,Sibanye Stillwater Ltd,Basic Materials,1040,Gold and Silver Ores,Silver & Precious Metals,Large accelerated filer,T3,,0,
SBUX,STARBUCKS CORP,Consumer Cyclical,5810,Retail-Eating & Drinking Places,,Large accelerated filer,WA,2025-11-14,37841,"In this Annual Report on Form 10-K (""10-K"" or ""Report"") for the fiscal year ended September 28, 2025 (""fiscal 2025""), Starbucks Corporation (together with its subsidiaries) is referred to as ""Starbucks,"" the ""Company,"" ""we,"" ""us,"" or ""our."" Starbucks is the premier roaster, marketer, and retailer of specialty coffee in the world, operating in 89 markets. Formed in 1985, Starbucks Corporation's common stock trades on the Nasdaq Global Select Market (""Nasdaq"") under the symbol ""SBUX."
SCCO,SOUTHERN COPPER CORP/,Basic Materials,1000,Metal Mining,Copper & Base Metals,Large accelerated filer,DE,2026-02-27,63815,"We cannot predict if metals prices will rise or fall in the future. Extended significant future declines in metals prices, particularly copper, could have a material adverse impact on our results of operations, financial condition and value of our assets. Under very adverse market conditions, we might consider curtailing or modifying some of our mining and processing operations."
SCHW,SCHWAB CHARLES CORP,Financial,6211,"Security Brokers, Dealers & Flotation Companies",Capital Markets & Trading,Large accelerated filer,DE,2026-02-25,49882,"General Corporate Overview The Charles Schwab Corporation (CSC) is a savings and loan holding company. CSC engages, through its subsidiaries (collectively referred to as Schwab or the Company), in wealth management, securities brokerage, banking, asset management, custody, and financial advisory services. At December 31, 2025, Schwab had $11.90 trillion in client assets, 38.5 million active brokerage accounts, 5.7 million workplace plan participant accounts, and 2.2 million banking accounts."
SCI,SERVICE CORP INTERNATIONAL,Consumer Cyclical,7200,Services-Personal Services,,Large accelerated filer,TX,2026-02-12,80000,"Information regarding legal proceedings is set forth in Note 9 of Part II, Item 8. Financial Statements and Supplementary Data. 22 Service Corporation International Our common stock has been traded on the New York Stock Exchange since May 14, 1974. On December 31, 2025, there were 2,807 holders of record of our common stock. In calculating the number of stockholders, we consider clearing agencies and security position listings as one stockholder for each agency or listing."
SDRL,Seadrill Ltd,Energy,1381,Drilling Oil & Gas Wells,,Large accelerated filer,,2026-02-26,23474,"We are an offshore drilling contractor providing worldwide offshore drilling services to the oil and gas industry. Our primary business is the ownership and operation of drillships and semi-submersible rigs for operations in shallow to ultra-deepwater in both benign and harsh environments. We contract our drilling units to drill wells for our customers on a dayrate basis. Our customers include oil super-majors, state-owned national oil companies, and independent oil and gas companies."
SE,Sea Ltd,Consumer Cyclical,7380,Services-Miscellaneous Business Services,,Large accelerated filer,E9,,0,
SEDG,"SOLAREDGE TECHNOLOGIES, INC.",Technology,3674,Semiconductors & Related Devices,Solar & Power Electronics,Large accelerated filer,DE,2026-02-25,79999,"For the year ended December 31, 2025, one customer accounted for 18.6% of our revenues and our top three customers together represented 35.8% of our revenues. Our revenues were $1,184.4 million and $901.5 million for the year ended December 31, 2025 and 2024, respectively. For the year ended December 31, 2025 our gross profit was 16.6% as compared to gross loss of 97.3% for the year ended December 31, 2024. For the year ended December 31, 2025, our net loss was $405."
SEE,SEALED AIR CORP/DE,Consumer Cyclical,2820,"Plastic Material, Synth Resin/Rubber, Cellulos (No Glass)",,Large accelerated filer,DE,2026-03-02,30554,"The Company: Sealed Air Sealed Air Corporation (""Sealed Air"", or the ""Company"", also referred to as ""we"", ""us"", or ""our"") is a leading global provider of packaging solutions that integrate sustainable, high-performance materials, automation, equipment and services. Sealed Air designs, manufactures and delivers packaging solutions that preserve food, protect goods and automate packaging processes."
SEI,"Solaris Energy Infrastructure, Inc.",Energy,3533,Oil & Gas Field Machinery & Equipment,,Large accelerated filer,DE,2026-02-27,8831,"CAUTIONARY STATEMENT REGARDING FORWARD-LOOKING STATEMENTS This Annual Report on Form 10-K (this ""Annual Report"") includes ""forward-looking statements"" within the meaning of Section 27A of the Securities Act of 1933, as amended (the ""Securities Act""), and Section 21E of the Securities Exchange Act of 1934, as amended (the ""Exchange Act""), which involve risks, uncertainties and assumptions."
SEIC,SEI INVESTMENTS CO,Financial,6211,"Security Brokers, Dealers & Flotation Companies",Asset & Wealth Management,Large accelerated filer,PA,2026-02-23,34505,"SEI Investments Company (together, with its subsidiaries unless otherwise noted, ""SEI"" or the ""Company"") is a leading global provider of financial technology, operations, and asset management solutions that connect the financial services ecosystem across advice, asset management, and administration."
